{
  "schema_version": "benchmark-lab-pack:v2",
  "pack_id": "shared-l1-core",
  "pack_version": "1.0.0",
  "name": "Shared L1 Core V1",
  "description": "Custom synthetic controlled-context shared capability battery.",
  "level": "L1",
  "cases": [
    {
      "case_id": "evidence-traceability",
      "objective": "Answer synthetic factual questions from controlled context and cite exact evidence IDs.",
      "input": {
        "messages": [
          {"role": "system", "content": "Use only the supplied context assets. Return no unsupported facts."},
          {"role": "user", "content": "Answer three questions using the supplied operations notes: Q1 Delta station opening time; Q2 sealed spare-battery count; Q3 Delta station inspection code. Return only JSON with exactly key \"answers\". answers must be an array in Q1,Q2,Q3 order. Each item must have exactly keys \"question_id\", \"value\", and \"evidence_id\"."}
        ],
        "context_assets": [
          {
            "asset_id": "operations-notes",
            "sha256": "a4f3da3079f670bf249a2c3287c55cf9400bbf1ba8dd94a028f120c757ab5f0b",
            "media_type": "text/plain",
            "delivery": "inline_context",
            "source_locator": "benchmark-packs/v2/fixtures/shared-l1-v1/traceability.txt"
          }
        ]
      },
      "requirements": {
        "configuration_profile": "shared-json-object-v1",
        "response_contract": {"mode": "json_object", "schema": null},
        "tool_surface": {"id": "none", "required_tools": []},
        "minimum_context_tokens": 4096
      },
      "evaluators": [{"evaluator_id": "shared-l1-deterministic", "contract_version": "1.0.0"}],
      "hard_failure_rules": [],
      "repetitions": {"screen_trials": 1, "qualification_trials": 3},
      "tags": ["evidence-use", "traceability", "distractor-resistance"]
    },
    {
      "case_id": "conflicting-sources",
      "objective": "Detect equally authoritative current sources that disagree and refuse to fabricate a resolution.",
      "input": {
        "messages": [
          {"role": "system", "content": "Use only supplied context. Equal-authority current sources that disagree must be reported as a contradiction rather than resolved by guessing."},
          {"role": "user", "content": "Determine release_window_start. Return only JSON with exactly keys \"status\", \"field\", \"values\", and \"chosen_value\". values must list the conflicting value/evidence_id pairs. chosen_value must be null unless the supplied evidence actually resolves the conflict."}
        ],
        "context_assets": [
          {
            "asset_id": "release-source-a",
            "sha256": "95ca25ffbb228562e3b59d05578c532c74ce0c26a06040bba554752b1f51f83b",
            "media_type": "text/plain",
            "delivery": "inline_context",
            "source_locator": "benchmark-packs/v2/fixtures/shared-l1-v1/conflict-a.txt"
          },
          {
            "asset_id": "release-source-b",
            "sha256": "2a545e25e27602035f2a5a8520bb5eb8c6561c6679ce566860a9731b4faebe1e",
            "media_type": "text/plain",
            "delivery": "inline_context",
            "source_locator": "benchmark-packs/v2/fixtures/shared-l1-v1/conflict-b.txt"
          }
        ]
      },
      "requirements": {
        "configuration_profile": "shared-json-object-v1",
        "response_contract": {"mode": "json_object", "schema": null},
        "tool_surface": {"id": "none", "required_tools": []},
        "minimum_context_tokens": 4096
      },
      "evaluators": [{"evaluator_id": "shared-l1-deterministic", "contract_version": "1.0.0"}],
      "hard_failure_rules": [{"evaluator_id": "shared-l1-deterministic", "rule_id": "fabricated-conflict-resolution"}],
      "repetitions": {"screen_trials": 1, "qualification_trials": 3},
      "tags": ["contradiction", "evidence-use"]
    },
    {
      "case_id": "lifecycle-selection",
      "objective": "Select current evidence over explicitly superseded evidence and cite both use and rejection.",
      "input": {
        "messages": [
          {"role": "system", "content": "Use evidence lifecycle/status labels exactly as supplied. Superseded records must not control the current answer."},
          {"role": "user", "content": "What is the current batch_limit? Return only JSON with exactly keys \"status\", \"batch_limit\", \"evidence_id\", and \"ignored_evidence\". ignored_evidence must list any superseded record IDs that would otherwise suggest a different value."}
        ],
        "context_assets": [
          {
            "asset_id": "lifecycle-old",
            "sha256": "2bec787a88d305fb4b0ab2cc2236dede99bc60a5843e298e2d3ed7b3d89cdcb0",
            "media_type": "text/plain",
            "delivery": "inline_context",
            "source_locator": "benchmark-packs/v2/fixtures/shared-l1-v1/lifecycle-old.txt"
          },
          {
            "asset_id": "lifecycle-current",
            "sha256": "801be82914d4970b6367edf1f97fc31ea21d15c267c9f44819b5346b71229a35",
            "media_type": "text/plain",
            "delivery": "inline_context",
            "source_locator": "benchmark-packs/v2/fixtures/shared-l1-v1/lifecycle-current.txt"
          }
        ]
      },
      "requirements": {
        "configuration_profile": "shared-json-object-v1",
        "response_contract": {"mode": "json_object", "schema": null},
        "tool_surface": {"id": "none", "required_tools": []},
        "minimum_context_tokens": 4096
      },
      "evaluators": [{"evaluator_id": "shared-l1-deterministic", "contract_version": "1.0.0"}],
      "hard_failure_rules": [],
      "repetitions": {"screen_trials": 1, "qualification_trials": 3},
      "tags": ["evidence-lifecycle", "traceability"]
    },
    {
      "case_id": "repair-diagnosis",
      "objective": "Use supplied code and test evidence to identify the minimal defect without speculative refactoring.",
      "input": {
        "messages": [
          {"role": "system", "content": "Diagnose only from the supplied code and test evidence. Do not invent additional failures or propose unrelated refactors."},
          {"role": "user", "content": "Identify the defect and minimal fix. Return only JSON with exactly keys \"status\", \"bug_type\", \"faulty_expression\", \"minimal_fix\", and \"evidence_ids\". evidence_ids must identify the supplied assets supporting the diagnosis."}
        ],
        "context_assets": [
          {
            "asset_id": "repair-code",
            "sha256": "4b02a92a9162de119c6330e02d979fc1346b94d974fd429b574fe8093628bd41",
            "media_type": "text/x-python",
            "delivery": "inline_context",
            "source_locator": "benchmark-packs/v2/fixtures/shared-l1-v1/repair-code.py"
          },
          {
            "asset_id": "repair-test",
            "sha256": "62198d27ba2ab9c418b2c2c6226a3538cb661e0cc6cc695e9cf9a6f86c1e0a5e",
            "media_type": "text/plain",
            "delivery": "inline_context",
            "source_locator": "benchmark-packs/v2/fixtures/shared-l1-v1/repair-failure.txt"
          }
        ]
      },
      "requirements": {
        "configuration_profile": "shared-json-object-v1",
        "response_contract": {"mode": "json_object", "schema": null},
        "tool_surface": {"id": "none", "required_tools": []},
        "minimum_context_tokens": 4096
      },
      "evaluators": [{"evaluator_id": "shared-l1-deterministic", "contract_version": "1.0.0"}],
      "hard_failure_rules": [],
      "repetitions": {"screen_trials": 1, "qualification_trials": 3},
      "tags": ["code-diagnosis", "evidence-led-repair", "minimal-repair"]
    },
    {
      "case_id": "evidence-gap",
      "objective": "Recognize that relevant context does not contain the exact requested fact and refuse to infer it.",
      "input": {
        "messages": [
          {"role": "system", "content": "Use only supplied context. Do not infer an exact configuration value from neighboring settings."},
          {"role": "user", "content": "What is retry_backoff_ms? Return only JSON with exactly keys \"status\", \"value\", \"missing_fact\", and \"evidence_reviewed\". Use null for value when the exact fact is absent."}
        ],
        "context_assets": [
          {
            "asset_id": "runtime-notes",
            "sha256": "2dba9c9e5db15af4e3987b2ac506da9c0aff908b524a06c5405a8907df013188",
            "media_type": "text/plain",
            "delivery": "inline_context",
            "source_locator": "benchmark-packs/v2/fixtures/shared-l1-v1/evidence-gap.txt"
          }
        ]
      },
      "requirements": {
        "configuration_profile": "shared-json-object-v1",
        "response_contract": {"mode": "json_object", "schema": null},
        "tool_surface": {"id": "none", "required_tools": []},
        "minimum_context_tokens": 4096
      },
      "evaluators": [{"evaluator_id": "shared-l1-deterministic", "contract_version": "1.0.0"}],
      "hard_failure_rules": [{"evaluator_id": "shared-l1-deterministic", "rule_id": "fabricated-evidence-gap"}],
      "repetitions": {"screen_trials": 1, "qualification_trials": 3},
      "tags": ["missing-evidence", "blocked-vs-ready", "evidence-use"]
    }
  ]
}
